[
  {
    "eval_id": "triage_hf_0175",
    "category": "Defective Product",
    "case_facts": "Consumer dispute submitted under CPA 2019",
    "ground_truth": {
      "outcome": "Inconclusive",
      "sections_invoked": [
        "Section 2(10)",
        "Section 39"
      ],
      "relief_granted": "Refund / Compensation",
      "court": "District Commission",
      "citation": "NCDRC Precedent",
      "source_url": ""
    },
    "difficulty": "straightforward"
  },
  {
    "eval_id": "triage_hf_0505",
    "category": "Defective Product",
    "case_facts": "Consumer dispute submitted under CPA 2019",
    "ground_truth": {
      "outcome": "Inconclusive",
      "sections_invoked": [
        "Section 2(10)",
        "Section 39"
      ],
      "relief_granted": "Refund / Compensation",
      "court": "District Commission",
      "citation": "NCDRC Precedent",
      "source_url": ""
    },
    "difficulty": "straightforward"
  },
  {
    "eval_id": "triage_hf_0556",
    "category": "Defective Product",
    "case_facts": "Consumer dispute submitted under CPA 2019",
    "ground_truth": {
      "outcome": "Inconclusive",
      "sections_invoked": [
        "Section 2(10)",
        "Section 39"
      ],
      "relief_granted": "Refund / Compensation",
      "court": "District Commission",
      "citation": "NCDRC Precedent",
      "source_url": ""
    },
    "difficulty": "straightforward"
  },
  {
    "eval_id": "sc_ncdrc_1995_a7358e",
    "category": "Defective Product",
    "case_facts": "Consumer dispute submitted under CPA 2019",
    "ground_truth": {
      "outcome": "Inconclusive",
      "sections_invoked": [
        "Section 2(10)",
        "Section 39"
      ],
      "relief_granted": "Refund / Compensation",
      "court": "District Commission",
      "citation": "NCDRC Precedent",
      "source_url": ""
    },
    "difficulty": "straightforward"
  },
  {
    "eval_id": "triage_hf_0592",
    "category": "Defective Product",
    "case_facts": "Consumer dispute submitted under CPA 2019",
    "ground_truth": {
      "outcome": "Inconclusive",
      "sections_invoked": [
        "Section 2(10)",
        "Section 39"
      ],
      "relief_granted": "Refund / Compensation",
      "court": "District Commission",
      "citation": "NCDRC Precedent",
      "source_url": ""
    },
    "difficulty": "straightforward"
  },
  {
    "eval_id": "triage_hf_0154",
    "category": "Defective Product",
    "case_facts": "Consumer dispute submitted under CPA 2019",
    "ground_truth": {
      "outcome": "Inconclusive",
      "sections_invoked": [
        "Section 2(10)",
        "Section 39"
      ],
      "relief_granted": "Refund / Compensation",
      "court": "District Commission",
      "citation": "NCDRC Precedent",
      "source_url": ""
    },
    "difficulty": "straightforward"
  },
  {
    "eval_id": "triage_hf_0438",
    "category": "Defective Product",
    "case_facts": "Consumer dispute submitted under CPA 2019",
    "ground_truth": {
      "outcome": "Inconclusive",
      "sections_invoked": [
        "Section 2(10)",
        "Section 39"
      ],
      "relief_granted": "Refund / Compensation",
      "court": "District Commission",
      "citation": "NCDRC Precedent",
      "source_url": ""
    },
    "difficulty": "straightforward"
  },
  {
    "eval_id": "triage_hf_0605",
    "category": "Defective Product",
    "case_facts": "Consumer dispute submitted under CPA 2019",
    "ground_truth": {
      "outcome": "Inconclusive",
      "sections_invoked": [
        "Section 2(10)",
        "Section 39"
      ],
      "relief_granted": "Refund / Compensation",
      "court": "District Commission",
      "citation": "NCDRC Precedent",
      "source_url": ""
    },
    "difficulty": "straightforward"
  },
  {
    "eval_id": "triage_hf_0655",
    "category": "Defective Product",
    "case_facts": "Consumer dispute submitted under CPA 2019",
    "ground_truth": {
      "outcome": "Inconclusive",
      "sections_invoked": [
        "Section 2(10)",
        "Section 39"
      ],
      "relief_granted": "Refund / Compensation",
      "court": "District Commission",
      "citation": "NCDRC Precedent",
      "source_url": ""
    },
    "difficulty": "straightforward"
  },
  {
    "eval_id": "triage_hf_0625",
    "category": "Defective Product",
    "case_facts": "Consumer dispute submitted under CPA 2019",
    "ground_truth": {
      "outcome": "Inconclusive",
      "sections_invoked": [
        "Section 2(10)",
        "Section 39"
      ],
      "relief_granted": "Refund / Compensation",
      "court": "District Commission",
      "citation": "NCDRC Precedent",
      "source_url": ""
    },
    "difficulty": "straightforward"
  },
  {
    "eval_id": "triage_hf_0586",
    "category": "Defective Product",
    "case_facts": "Consumer dispute submitted under CPA 2019",
    "ground_truth": {
      "outcome": "Inconclusive",
      "sections_invoked": [
        "Section 2(10)",
        "Section 39"
      ],
      "relief_granted": "Refund / Compensation",
      "court": "District Commission",
      "citation": "NCDRC Precedent",
      "source_url": ""
    },
    "difficulty": "straightforward"
  },
  {
    "eval_id": "triage_hf_0110",
    "category": "Defective Product",
    "case_facts": "Consumer dispute submitted under CPA 2019",
    "ground_truth": {
      "outcome": "Inconclusive",
      "sections_invoked": [
        "Section 2(10)",
        "Section 39"
      ],
      "relief_granted": "Refund / Compensation",
      "court": "District Commission",
      "citation": "NCDRC Precedent",
      "source_url": ""
    },
    "difficulty": "straightforward"
  },
  {
    "eval_id": "triage_hf_0004",
    "category": "Defective Product",
    "case_facts": "Consumer dispute submitted under CPA 2019",
    "ground_truth": {
      "outcome": "Inconclusive",
      "sections_invoked": [
        "Section 2(10)",
        "Section 39"
      ],
      "relief_granted": "Refund / Compensation",
      "court": "District Commission",
      "citation": "NCDRC Precedent",
      "source_url": ""
    },
    "difficulty": "straightforward"
  },
  {
    "eval_id": "triage_hf_0250",
    "category": "Defective Product",
    "case_facts": "Consumer dispute submitted under CPA 2019",
    "ground_truth": {
      "outcome": "Inconclusive",
      "sections_invoked": [
        "Section 2(10)",
        "Section 39"
      ],
      "relief_granted": "Refund / Compensation",
      "court": "District Commission",
      "citation": "NCDRC Precedent",
      "source_url": ""
    },
    "difficulty": "straightforward"
  },
  {
    "eval_id": "triage_hf_0534",
    "category": "Defective Product",
    "case_facts": "Consumer dispute submitted under CPA 2019",
    "ground_truth": {
      "outcome": "Inconclusive",
      "sections_invoked": [
        "Section 2(10)",
        "Section 39"
      ],
      "relief_granted": "Refund / Compensation",
      "court": "District Commission",
      "citation": "NCDRC Precedent",
      "source_url": ""
    },
    "difficulty": "straightforward"
  },
  {
    "eval_id": "triage_hf_0472",
    "category": "Defective Product",
    "case_facts": "Consumer dispute submitted under CPA 2019",
    "ground_truth": {
      "outcome": "Inconclusive",
      "sections_invoked": [
        "Section 2(10)",
        "Section 39"
      ],
      "relief_granted": "Refund / Compensation",
      "court": "District Commission",
      "citation": "NCDRC Precedent",
      "source_url": ""
    },
    "difficulty": "straightforward"
  },
  {
    "eval_id": "triage_hf_0383",
    "category": "Defective Product",
    "case_facts": "Consumer dispute submitted under CPA 2019",
    "ground_truth": {
      "outcome": "Inconclusive",
      "sections_invoked": [
        "Section 2(10)",
        "Section 39"
      ],
      "relief_granted": "Refund / Compensation",
      "court": "District Commission",
      "citation": "NCDRC Precedent",
      "source_url": ""
    },
    "difficulty": "straightforward"
  },
  {
    "eval_id": "triage_hf_0387",
    "category": "Defective Product",
    "case_facts": "Consumer dispute submitted under CPA 2019",
    "ground_truth": {
      "outcome": "Inconclusive",
      "sections_invoked": [
        "Section 2(10)",
        "Section 39"
      ],
      "relief_granted": "Refund / Compensation",
      "court": "District Commission",
      "citation": "NCDRC Precedent",
      "source_url": ""
    },
    "difficulty": "straightforward"
  },
  {
    "eval_id": "triage_hf_0058",
    "category": "Defective Product",
    "case_facts": "Consumer dispute submitted under CPA 2019",
    "ground_truth": {
      "outcome": "Inconclusive",
      "sections_invoked": [
        "Section 2(10)",
        "Section 39"
      ],
      "relief_granted": "Refund / Compensation",
      "court": "District Commission",
      "citation": "NCDRC Precedent",
      "source_url": ""
    },
    "difficulty": "straightforward"
  },
  {
    "eval_id": "triage_hf_0626",
    "category": "Defective Product",
    "case_facts": "Consumer dispute submitted under CPA 2019",
    "ground_truth": {
      "outcome": "Inconclusive",
      "sections_invoked": [
        "Section 2(10)",
        "Section 39"
      ],
      "relief_granted": "Refund / Compensation",
      "court": "District Commission",
      "citation": "NCDRC Precedent",
      "source_url": ""
    },
    "difficulty": "straightforward"
  },
  {
    "eval_id": "triage_hf_0627",
    "category": "Defective Product",
    "case_facts": "Consumer dispute submitted under CPA 2019",
    "ground_truth": {
      "outcome": "Inconclusive",
      "sections_invoked": [
        "Section 2(10)",
        "Section 39"
      ],
      "relief_granted": "Refund / Compensation",
      "court": "District Commission",
      "citation": "NCDRC Precedent",
      "source_url": ""
    },
    "difficulty": "straightforward"
  },
  {
    "eval_id": "triage_hf_0149",
    "category": "Defective Product",